{
  "screen": "medias",
  "generatedFrom": "Le DM téléverse ses battlemaps et illustrations et règle la grille hexagonale de chaque carte avec un aperçu en direct",
  "version": 2,
  "surface": "dm",
  "layout": [
    { "MediaLibrary": { "campaign": "$ctx.campaign", "session": "s4", "sessionNumber": 4 } },
    { "GridSettings": { "battlemap": "$ctx.battlemap" } }
  ]
}
