{
  "screen": "player-view",
  "generatedFrom": "Les joueurs voient la couverture, la battlemap ou l’illustration envoyée par le DM ; dans l’onglet piloté, le DM y déplace tokens et fenêtre et cadre la carte",
  "version": 1,
  "layout": [
    { "PlayerStage": {} },
    { "Battlemap": { "instance": "$ctx.battlemap", "view": "player", "fill": true } }
  ]
}
