{
  "screen": "fiche-entite",
  "generatedFrom": "Le DM renseigne un personnage, un lieu ou un événement, dicte le prompt initial pour obtenir background et statblock, importe un PJ de D&D Beyond et annule un changement de l’IA",
  "version": 1,
  "surface": "dm",
  "layout": [
    { "CampaignElements": { "mode": "rail", "campaign": "cendres-valombre" } },
    { "EntityEditor": {} },
    { "VersionHistory": { "entity": "$ctx.entity" } }
  ]
}
